{
  "$schema": "https://json-schema.org/draft/2020-12/schema",
  "$id": "https://github.com/perniemann/pnCore/docs/refs/context-index.schema.json",
  "title": "pnCore context index",
  "type": "object",
  "additionalProperties": false,
  "required": ["version", "last_reviewed", "pointers"],
  "properties": {
    "version": {
      "type": "string",
      "description": "Semver for index contract changes",
      "pattern": "^[0-9]+\\.[0-9]+\\.[0-9]+$"
    },
    "last_reviewed": {
      "type": "string",
      "description": "ISO 8601 date (YYYY-MM-DD)",
      "pattern": "^[0-9]{4}-[0-9]{2}-[0-9]{2}$"
    },
    "git_sha": {
      "type": "string",
      "description": "Optional commit at last refresh"
    },
    "intent_source": {
      "type": "string",
      "description": "When discovery vs PRD conflict was resolved",
      "enum": ["prd", "discovery", "chat"]
    },
    "pointers": {
      "type": "object",
      "additionalProperties": false,
      "required": ["workspace"],
      "properties": {
        "prd": {
          "type": ["string", "null"],
          "description": "Product requirements doc path, repo-relative"
        },
        "discovery": {
          "type": ["string", "null"],
          "description": "Latest signed discovery spec path"
        },
        "workspace": {
          "type": "string",
          "description": "Workspace bootstrap (e.g. AGENTS.md or project-context)"
        },
        "product": {
          "type": ["string", "null"],
          "description": "Product/architecture narrative when no PRD"
        },
        "workflow_state_schema": {
          "type": ["string", "null"],
          "description": "Normative workflow state schema path"
        },
        "quarterly_audit": {
          "type": ["string", "null"],
          "description": "Latest quarterly skill/rule audit note (ADR-0002)"
        },
        "current_checkpoint": {
          "type": ["string", "null"],
          "description": "Artifact id (not a path) of the current checkpoint; that artifact must have lifecycle \"current\". project_context compares its run_id to the workflow state run_id"
        }
      }
    },
    "owned_paths": {
      "type": "array",
      "items": { "type": "string", "minLength": 1 }
    },
    "acceptance_criteria_ids": {
      "type": "array",
      "items": {
        "type": "string",
        "pattern": "^AC-[0-9]+$"
      }
    },
    "verify": {
      "type": "array",
      "items": {
        "type": "object",
        "additionalProperties": false,
        "required": ["command", "expect"],
        "properties": {
          "command": { "type": "string", "minLength": 1 },
          "expect": { "type": "string", "minLength": 1 }
        }
      }
    },
    "artifacts": {
      "type": "array",
      "description": "Typed project artifacts (one catalog). Authored status is a claim; derived status comes from attestations.",
      "items": {
        "type": "object",
        "additionalProperties": false,
        "required": ["id", "type", "path"],
        "properties": {
          "id": {
            "type": "string",
            "minLength": 1,
            "description": "Stable artifact id (e.g. convention-ac, plan-auth)"
          },
          "type": {
            "type": "string",
            "enum": ["discovery", "plan", "prd", "design", "workflow", "convention"]
          },
          "path": {
            "type": "string",
            "minLength": 1,
            "description": "Repo-relative path to the markdown/doc file"
          },
          "tracker": {
            "type": ["string", "null"],
            "description": "Optional GitHub/Paperclip issue id; not derived truth by itself"
          },
          "authored_status": {
            "type": ["string", "null"],
            "description": "Human/agent claim only — never treat as derived completion"
          },
          "run_id": {
            "type": ["string", "null"],
            "description": "Optional workflow run_id for attested completion via run-events"
          },
          "lifecycle": {
            "type": "string",
            "enum": ["current", "historical", "superseded"],
            "description": "current: the live entry (at most one per type). historical / superseded: kept as evidence; their findings and failure caps are never treated as current blockers"
          },
          "superseded_by": {
            "type": "string",
            "minLength": 1,
            "description": "Artifact id that replaces this one; required when lifecycle is superseded"
          }
        }
      }
    }
  }
}
