{
  "version": "1.4.0",
  "last_reviewed": "2026-09-17",
  "intent_source": "prd",
  "pointers": {
    "prd": null,
    "discovery": null,
    "workspace": "AGENTS.md",
    "product": "docs/plugin-reference.md",
    "workflow_state_schema": "packages/pn-core-mcp/content/reference/workflow-state-schema.md",
    "quarterly_audit": "docs/refs/audit-2026-Q3.md"
  },
  "owned_paths": [
    "plugins/pnCore/",
    "packages/pn-core-mcp/",
    "scripts/",
    "docs/",
    ".github/"
  ],
  "acceptance_criteria_ids": ["AC-1", "AC-2"],
  "artifacts": [
    {
      "id": "convention-ac",
      "type": "convention",
      "path": "docs/acceptance-criteria-convention.md"
    },
    {
      "id": "convention-commits",
      "type": "convention",
      "path": "docs/commits.md"
    },
    {
      "id": "convention-context-adopters",
      "type": "convention",
      "path": "docs/context-index-adopters.md"
    },
    {
      "id": "reference-companion-mcp-catalog",
      "type": "convention",
      "path": "docs/companion-mcp-catalog.md"
    },
    {
      "id": "workflow-state-schema",
      "type": "workflow",
      "path": "packages/pn-core-mcp/content/reference/workflow-state-schema.md"
    },
    {
      "id": "convention-consumer-gating",
      "type": "convention",
      "path": "packages/pn-core-mcp/content/reference/consumer-gating.md"
    },
    {
      "id": "adr-0015-consumer-gating",
      "type": "convention",
      "path": "docs/adr/0015-consumer-project-gating.md"
    }
  ],
  "verify": [
    {
      "command": "npm run validate",
      "expect": "exit 0 — plugin and workflow validators"
    },
    {
      "command": "npm run check:context-index",
      "expect": "exit 0 — this index matches schema and pointer paths exist"
    },
    {
      "command": "npm run check:artifact-status",
      "expect": "exit 0 — artifact paths exist; no authored-complete without attestation"
    }
  ]
}
